{
  "id": "p-8392",
  "type": "physical",
  "identity": {
    "name": "Silk Mini Dress Midnight",
    "slug": "silk-mini-dress-midnight",
    "sku": "DRESS-8392",
    "barcode": "1234567890123",
    "brand": "Your Brand",
    "status": "active"
  },
  "pricing": {
    "currency": "USD",
    "price": 89,
    "compareAtPrice": 120,
    "costPrice": 45,
    "taxClass": "standard"
  },
  "description": {
    "short": "Luxurious silk mini dress for evening wear.",
    "full": "<p>Hand-crafted from 100% mulberry silk, this mini dress drapes beautifully and feels incredible against the skin. Perfect for cocktail parties, date nights, and special occasions.</p><ul><li>100% Silk</li><li>Dry clean only</li><li>Made in Italy</li></ul>",
    "highlights": []
  },
  "categories": [
    "dresses",
    "dresses/mini-dresses",
    "new-arrivals",
    "mini-dresses"
  ],
  "tags": [
    "new-arrival",
    "silk",
    "evening",
    "black",
    "luxury"
  ],
  "attributes": [],
  "variants": [
    {
      "id": "v-8392-blk-s",
      "sku": "8392-BLK-S",
      "options": {
        "Color": "Black",
        "Size": "S"
      },
      "price": 89,
      "weight": 0.3,
      "stock": 12,
      "lowStockThreshold": 3,
      "backorder": false,
      "image": "https://cdn.yourbrand.com/products/p-8392/blk.webp"
    },
    {
      "id": "v-8392-blk-m",
      "sku": "8392-BLK-M",
      "options": {
        "Color": "Black",
        "Size": "M"
      },
      "price": 89,
      "weight": 0.3,
      "stock": 8,
      "lowStockThreshold": 3,
      "backorder": false,
      "image": "https://cdn.yourbrand.com/products/p-8392/blk.webp"
    },
    {
      "id": "v-8392-red-s",
      "sku": "8392-RED-S",
      "options": {
        "Color": "Red",
        "Size": "S"
      },
      "price": 89,
      "weight": 0.3,
      "stock": 3,
      "lowStockThreshold": 3,
      "backorder": true,
      "image": "https://cdn.yourbrand.com/products/p-8392/red.webp"
    }
  ],
  "media": {
    "images": [],
    "videos": []
  },
  "ugc": [],
  "relations": {
    "related": [],
    "upsells": [],
    "crossSells": []
  },
  "shipping": {
    "profile": "standard",
    "weight": 0.3,
    "requiresShipping": true
  },
  "seo": {
    "title": "Silk Mini Dress Midnight | Your Brand",
    "description": "Shop the Silk Mini Dress in Midnight. 100% silk, perfect for evening events. Free shipping on orders over $75.",
    "canonical": "/product/silk-mini-dress-midnight",
    "ogImage": "https://cdn.yourbrand.com/products/p-8392/og.webp"
  },
  "meta": {
    "updatedAt": "2026-08-11T05:33:27.043Z"
  }
}