{
  "id": "p-pp-009",
  "type": "physical",
  "identity": {
    "name": "Projecting Button Up Top Ivory",
    "slug": "projecting-button-up-top-ivory",
    "sku": "PROJECTINGBU-019",
    "barcode": "7800000000019",
    "brand": "Princess Polly",
    "status": "active"
  },
  "pricing": {
    "currency": "USD",
    "price": 55,
    "compareAtPrice": 55,
    "costPrice": 23.1,
    "taxClass": "standard"
  },
  "description": {
    "short": "Collared button-up top with lace detail and shirred open back.",
    "full": "Collared button-up top with lace detail and shirred open back.\nResearched product details: LENZING ECOVERO viscose / organic cotton lining. Regular fit. See the official product page for current availability and care guidance.\n\n### Highlights\n\n- Collared\n- Lace detailing\n- Shirred back\n- Back boning",
    "highlights": [
      "Collared",
      "Lace detailing",
      "Shirred back",
      "Back boning"
    ]
  },
  "categories": [
    "tops",
    "tops/blouses",
    "new-arrivals"
  ],
  "tags": [
    "projecting",
    "new-arrivals",
    "princess-polly"
  ],
  "attributes": [
    {
      "name": "Material",
      "value": "LENZING ECOVERO viscose / organic cotton lining",
      "group": "fabric",
      "visible": true,
      "filterable": true
    },
    {
      "name": "Fit",
      "value": "Regular",
      "group": "fit",
      "visible": true,
      "filterable": true
    }
  ],
  "variants": [
    {
      "id": "v-pp-009-blk-us0",
      "sku": "PROJECTINGBU-019-BLK-01",
      "options": {
        "Color": "Ivory",
        "Size": "US 0"
      },
      "price": 55,
      "weight": 0.3,
      "image": "https://us.princesspolly.com/cdn/shop/files/0-modelinfo-ella-us2_79ac623e-fcaa-448a-a72f-60213f40942d.jpg?v=1752115220",
      "stock": 4,
      "lowStockThreshold": 3,
      "backorder": false,
      "variantGroup": "ivory"
    },
    {
      "id": "v-pp-009-blk-us2",
      "sku": "PROJECTINGBU-019-BLK-02",
      "options": {
        "Color": "Ivory",
        "Size": "US 2"
      },
      "price": 55,
      "weight": 0.3,
      "image": "https://us.princesspolly.com/cdn/shop/files/0-modelinfo-ella-us2_79ac623e-fcaa-448a-a72f-60213f40942d.jpg?v=1752115220",
      "stock": 7,
      "lowStockThreshold": 3,
      "backorder": false,
      "variantGroup": "ivory"
    },
    {
      "id": "v-pp-009-blk-us4",
      "sku": "PROJECTINGBU-019-BLK-03",
      "options": {
        "Color": "Ivory",
        "Size": "US 4"
      },
      "price": 55,
      "weight": 0.3,
      "image": "https://us.princesspolly.com/cdn/shop/files/0-modelinfo-ella-us2_79ac623e-fcaa-448a-a72f-60213f40942d.jpg?v=1752115220",
      "stock": 11,
      "lowStockThreshold": 3,
      "backorder": false,
      "variantGroup": "ivory"
    },
    {
      "id": "v-pp-009-blk-us6",
      "sku": "PROJECTINGBU-019-BLK-04",
      "options": {
        "Color": "Ivory",
        "Size": "US 6"
      },
      "price": 55,
      "weight": 0.3,
      "image": "https://us.princesspolly.com/cdn/shop/files/0-modelinfo-ella-us2_79ac623e-fcaa-448a-a72f-60213f40942d.jpg?v=1752115220",
      "stock": 14,
      "lowStockThreshold": 3,
      "backorder": false,
      "variantGroup": "ivory"
    },
    {
      "id": "v-pp-009-blk-us8",
      "sku": "PROJECTINGBU-019-BLK-05",
      "options": {
        "Color": "Ivory",
        "Size": "US 8"
      },
      "price": 55,
      "weight": 0.3,
      "image": "https://us.princesspolly.com/cdn/shop/files/0-modelinfo-ella-us2_79ac623e-fcaa-448a-a72f-60213f40942d.jpg?v=1752115220",
      "stock": 9,
      "lowStockThreshold": 3,
      "backorder": false,
      "variantGroup": "ivory"
    },
    {
      "id": "v-pp-009-blk-us10",
      "sku": "PROJECTINGBU-019-BLK-06",
      "options": {
        "Color": "Ivory",
        "Size": "US 10"
      },
      "price": 55,
      "weight": 0.3,
      "image": "https://us.princesspolly.com/cdn/shop/files/0-modelinfo-ella-us2_79ac623e-fcaa-448a-a72f-60213f40942d.jpg?v=1752115220",
      "stock": 5,
      "lowStockThreshold": 3,
      "backorder": false,
      "variantGroup": "ivory"
    },
    {
      "id": "v-pp-009-blk-us12",
      "sku": "PROJECTINGBU-019-BLK-07",
      "options": {
        "Color": "Ivory",
        "Size": "US 12"
      },
      "price": 55,
      "weight": 0.3,
      "image": "https://us.princesspolly.com/cdn/shop/files/0-modelinfo-ella-us2_79ac623e-fcaa-448a-a72f-60213f40942d.jpg?v=1752115220",
      "stock": 8,
      "lowStockThreshold": 3,
      "backorder": false,
      "variantGroup": "ivory"
    }
  ],
  "media": {
    "images": [
      {
        "url": "https://us.princesspolly.com/cdn/shop/files/0-modelinfo-ella-us2_79ac623e-fcaa-448a-a72f-60213f40942d.jpg?v=1752115220",
        "alt": "Projecting Button Up Top Ivory - ivory variant image 1",
        "type": "image",
        "order": 1,
        "variantGroup": "ivory"
      },
      {
        "url": "https://us.princesspolly.com/cdn/shop/files/1-modelinfo-ella-us2_877329a7-ba56-4f07-bc40-b300cbc1ca49.jpg?v=1752115220",
        "alt": "Projecting Button Up Top Ivory - ivory variant image 2",
        "type": "image",
        "order": 2,
        "variantGroup": "ivory"
      },
      {
        "url": "https://us.princesspolly.com/cdn/shop/files/2-modelinfo-ella-us2_46e76018-8bbb-412b-9223-868e6b77890e.jpg?v=1752115220",
        "alt": "Projecting Button Up Top Ivory - ivory variant image 3",
        "type": "image",
        "order": 3,
        "variantGroup": "ivory"
      },
      {
        "url": "https://us.princesspolly.com/cdn/shop/files/3-modelinfo-ella-us2_110c4937-3b95-48ad-a32e-6d3b46acb6a0.jpg?v=1752115220",
        "alt": "Projecting Button Up Top Ivory - ivory variant image 4",
        "type": "image",
        "order": 4,
        "variantGroup": "ivory"
      },
      {
        "url": "https://us.princesspolly.com/cdn/shop/files/1-modelinfo-rafaela-us2_de52ce88-1ade-4fe0-9b3d-e46b0b1abac1.jpg?v=1771300686",
        "alt": "Projecting Button Up Top Ivory - ivory variant image 5",
        "type": "image",
        "order": 5,
        "variantGroup": "ivory"
      },
      {
        "url": "https://us.princesspolly.com/cdn/shop/files/2-modelinfo-rafaela-us2_be9c31c6-f6a1-4038-96f7-e51346ea1b17.jpg?v=1771300687",
        "alt": "Projecting Button Up Top Ivory - ivory variant image 6",
        "type": "image",
        "order": 6,
        "variantGroup": "ivory"
      }
    ],
    "videos": []
  },
  "ugc": [],
  "relations": {
    "related": [],
    "upsells": [],
    "crossSells": []
  },
  "shipping": {
    "profile": "standard",
    "weight": 0.3,
    "dimensions": {
      "l": 30,
      "w": 22,
      "h": 5,
      "unit": "cm"
    },
    "requiresShipping": true
  },
  "seo": {
    "title": "Projecting Button Up Top Ivory | Princess Polly",
    "description": "Shop Projecting Button Up Top Ivory from Princess Polly.",
    "keywords": [
      "projecting button up top ivory",
      "tops",
      "princess polly"
    ],
    "ogImage": "https://us.princesspolly.com/cdn/shop/files/0-modelinfo-ella-us2_79ac623e-fcaa-448a-a72f-60213f40942d.jpg?v=1752115220",
    "canonical": "/product/projecting-button-up-top-ivory",
    "structuredData": {
      "@context": "https://schema.org",
      "@type": "Product",
      "name": "Projecting Button Up Top Ivory",
      "brand": {
        "@type": "Brand",
        "name": "Princess Polly"
      },
      "offers": {
        "@type": "Offer",
        "price": 55,
        "priceCurrency": "USD"
      }
    }
  },
  "meta": {
    "createdAt": "2026-08-13T00:00:00Z",
    "updatedAt": "2026-08-13T00:00:00Z",
    "publishedAt": "2026-08-13T00:00:00Z"
  }
}
